<?xml version="1.0" encoding="UTF-8"?>
<template name="TestTemplate" xmlns="http://www.mallox.de/schema/template"
	xmlns:xsi="http://www.w3.org/2001/XMLSchema-instance"
	xsi:schemaLocation="http://www.mallox.de/schema/template ../../../../../../../../main/resources/template.xsd ">
	<description>description</description>

	<variable type="string" default="Template" name="ComponentName">
		<description>ComponentName</description>
	</variable>

	<variable type="boolean" default="true" name="TestFlag">
		<description>Flag mit dem etwas gesteuert werden kann.</description>
	</variable>

	<variable type="int" default="10" name="TestCount">
		<description>ComponentName</description>
	</variable>

	<variableCombinations name="testCombination" pattern="">
		<description>Test einer neu zusammengesetzten Variable</description>
	</variableCombinations>

	<project-template name="TestJava">
		<description>Projekt-Template</description>

		<projectDescription>
			<projectDependencies>ExternalGuiceJava</projectDependencies>
			<buildCommand name="org.eclipse.jdt.core.javabuilder"></buildCommand>
			<nature>org.eclipse.jdt.core.javanature</nature>
		</projectDescription>

		<classpathentries kind="src" path="src/main/java" />

		<files src="test-template.xml" dest="test/test-template.xml" condition="TestFlag" conditionValue="true"/>
		
		<files src="test-template2.xml" dest="test/test-template2.xml" condition="TestFlag" conditionValue="false"/>

	</project-template>

</template>
